<?xml version="1.0"?>

<workflow-definition
	xmlns="urn:liferay.com:liferay-workflow_7.4.0"
	xmlns:xsi="http://www.w3.org/2001/XMLSchema-instance"
	xsi:schemaLocation="urn:liferay.com:liferay-workflow_7.4.0 http://www.liferay.com/dtd/liferay-workflow-definition_7_4_0.xsd"
>
	<name>Improve Writing</name>
	<description>Enhances clarity, flow, and word choice. It removes fluff and tightens phrasing to make your message more impactful.</description>
	<version>1</version>
	<llm>
		<name>improveWriting</name>
		<metadata>
			<![CDATA[
				{
					"xy": [
						276,
						242
					]
				}
			]]>
		</metadata>
		<labels>
			<label language-id="en_US">
				Improve Writing
			</label>
		</labels>
		<input-variables>
			<![CDATA[
[
	{
		"name": "content",
		"type": "string"
	},
	{
		"name": "text",
		"type": "string"
	},
	{
		"name": "title",
		"type": "string"
	},
	{
		"name": "tone",
		"type": "string"
	},
	{
		"name": "userMessage",
		"type": "string"
	}
]
]]>
		</input-variables>
		<output-variables>
			<![CDATA[
[
	{
		"name": "rewrittenText",
		"type": "string"
	}
]
]]>
		</output-variables>
		<prompt>
			<![CDATA[You are a professional writing editor. Your sole task is to take the provided text and rewrite it to be significantly more concise, direct, and free of unnecessary filler words, nominalizations, and passive voice, while retaining the original meaning and professional tone. Only output the revised, concise text. Do not include any explanation, introduction, or conversation.
]]>
		</prompt>
		<tools>
			<![CDATA[
[]
]]>
		</tools>
		<transitions>
			<transition>
				<labels>
					<label language-id="en_US">
						End
					</label>
				</labels>
				<name>end</name>
				<target>end</target>
				<default>true</default>
			</transition>
		</transitions>
		<user-message>
			<![CDATA[This is the text to be rewritten: {{text}}
]]>
		</user-message>
	</llm>
	<state>
		<name>start</name>
		<metadata>
			<![CDATA[
				{
					"xy": [
						273,
						25
					]
				}
			]]>
		</metadata>
		<initial>true</initial>
		<labels>
			<label language-id="en_US">
				Start
			</label>
		</labels>
		<transitions>
			<transition>
				<labels>
					<label language-id="en_US">
						Improve Writing
					</label>
				</labels>
				<name>improveWriting</name>
				<target>improveWriting</target>
				<default>true</default>
			</transition>
		</transitions>
	</state>
	<state>
		<name>end</name>
		<metadata>
			<![CDATA[
				{
					"terminal": true,
					"xy": [
						277,
						459
					]
				}
			]]>
		</metadata>
		<labels>
			<label language-id="en_US">
				End
			</label>
		</labels>
	</state>
</workflow-definition>