<?xml version="1.0"?>

<workflow-definition
	xmlns="urn:liferay.com:liferay-workflow_7.4.0"
	xmlns:xsi="http://www.w3.org/2001/XMLSchema-instance"
	xsi:schemaLocation="urn:liferay.com:liferay-workflow_7.4.0 http://www.liferay.com/dtd/liferay-workflow-definition_7_4_0.xsd"
>
	<name>Fix Spelling and Grammar</name>
	<description>Automatically detects and corrects typos, punctuation errors, and grammatical slips to ensure your work is polished and credible.</description>
	<version>1</version>
	<llm>
		<name>fixSpellingAndGrammar</name>
		<metadata>
			<![CDATA[
				{
					"xy": [
						276,
						242
					]
				}
			]]>
		</metadata>
		<labels>
			<label language-id="en_US">
				Fix Spelling and Grammar
			</label>
		</labels>
		<input-variables>
			<![CDATA[
[
	{
		"name": "content",
		"type": "string"
	},
	{
		"name": "text",
		"type": "string"
	},
	{
		"name": "title",
		"type": "string"
	},
	{
		"name": "tone",
		"type": "string"
	},
	{
		"name": "userMessage",
		"type": "string"
	}
]
]]>
		</input-variables>
		<output-variables>
			<![CDATA[
[
	{
		"name": "rewrittenText",
		"type": "string"
	}
]
]]>
		</output-variables>
		<prompt>
			<![CDATA[You are an expert linguistic editor. Your sole task is to correct all grammatical, spelling, and punctuation errors in the provided text while preserving its meaning, tone, and style. Do not alter structure or wording beyond what is necessary for grammatical precision and natural fluency. Output only the corrected text, with no explanations or commentary. If the text is already correct, return it unchanged.
]]>
		</prompt>
		<tools>
			<![CDATA[
[]
]]>
		</tools>
		<transitions>
			<transition>
				<labels>
					<label language-id="en_US">
						End
					</label>
				</labels>
				<name>end</name>
				<target>end</target>
				<default>true</default>
			</transition>
		</transitions>
		<user-message>
			<![CDATA[This is the text to be fixed: {{text}}
]]>
		</user-message>
	</llm>
	<state>
		<name>start</name>
		<metadata>
			<![CDATA[
				{
					"xy": [
						273,
						25
					]
				}
			]]>
		</metadata>
		<initial>true</initial>
		<labels>
			<label language-id="en_US">
				Start
			</label>
		</labels>
		<transitions>
			<transition>
				<labels>
					<label language-id="en_US">
						Fix Spelling and Grammar
					</label>
				</labels>
				<name>fixSpellingAndGrammar</name>
				<target>fixSpellingAndGrammar</target>
				<default>true</default>
			</transition>
		</transitions>
	</state>
	<state>
		<name>end</name>
		<metadata>
			<![CDATA[
				{
					"terminal": true,
					"xy": [
						277,
						459
					]
				}
			]]>
		</metadata>
		<labels>
			<label language-id="en_US">
				End
			</label>
		</labels>
	</state>
</workflow-definition>