<?xml version="1.0"?>

<workflow-definition
	xmlns="urn:liferay.com:liferay-workflow_7.4.0"
	xmlns:xsi="http://www.w3.org/2001/XMLSchema-instance"
	xsi:schemaLocation="urn:liferay.com:liferay-workflow_7.4.0 http://www.liferay.com/dtd/liferay-workflow-definition_7_4_0.xsd"
>
	<name>Make Shorter</name>
	<description>Condenses your text into its most essential points, prioritizing brevity and directness for quick reading.</description>
	<version>1</version>
	<llm>
		<name>makeShorter</name>
		<metadata>
			<![CDATA[
				{
					"xy": [
						276,
						242
					]
				}
			]]>
		</metadata>
		<labels>
			<label language-id="en_US">
				Make Shorter
			</label>
		</labels>
		<input-variables>
			<![CDATA[
[
	{
		"name": "content",
		"type": "string"
	},
	{
		"name": "text",
		"type": "string"
	},
	{
		"name": "title",
		"type": "string"
	},
	{
		"name": "tone",
		"type": "string"
	},
	{
		"name": "userMessage",
		"type": "string"
	}
]
]]>
		</input-variables>
		<output-variables>
			<![CDATA[
[
	{
		"name": "rewrittenText",
		"type": "string"
	}
]
]]>
		</output-variables>
		<prompt>
			<![CDATA[You are an expert linguistic editor. Your sole task is to reduce the length of the provided text while preserving all essential information, key points, and original intent. Remove redundancy, filler, and unnecessary detail without changing meaning, tone, or clarity. If the text is already concise and cannot be shortened without losing important content, return it unchanged. Output only the shortened text, with no explanations or commentary.
]]>
		</prompt>
		<tools>
			<![CDATA[
[]
]]>
		</tools>
		<transitions>
			<transition>
				<labels>
					<label language-id="en_US">
						End
					</label>
				</labels>
				<name>end</name>
				<target>end</target>
				<default>true</default>
			</transition>
		</transitions>
		<user-message>
			<![CDATA[This is the text to be shortened: {{text}}
]]>
		</user-message>
	</llm>
	<state>
		<name>start</name>
		<metadata>
			<![CDATA[
				{
					"xy": [
						273,
						25
					]
				}
			]]>
		</metadata>
		<initial>true</initial>
		<labels>
			<label language-id="en_US">
				Start
			</label>
		</labels>
		<transitions>
			<transition>
				<labels>
					<label language-id="en_US">
						Make Shorter
					</label>
				</labels>
				<name>makeShorter</name>
				<target>makeShorter</target>
				<default>true</default>
			</transition>
		</transitions>
	</state>
	<state>
		<name>end</name>
		<metadata>
			<![CDATA[
				{
					"terminal": true,
					"xy": [
						277,
						459
					]
				}
			]]>
		</metadata>
		<labels>
			<label language-id="en_US">
				End
			</label>
		</labels>
	</state>
</workflow-definition>